{
  "schemaVersion": "1.0.0",
  "version": "0.1.0",
  "updatedAt": "2026-09-01",
  "channels": [
    {
      "slug": "tip-ogrencileri-platformu",
      "name": "Tıp Öğrencileri Platformu",
      "shortDescription": "Medical students in Türkiye: scholarships, internships, research, congresses, exchanges, and career opportunities.",
      "registryStatus": "ACTIVE",
      "language": "tr",
      "logo": "PASS",
      "colorPalette": "PASS",
      "typography": "UNSET",
      "monitoringSources": "UNSET",
      "channelPackPath": "channels/tip-ogrencileri-platformu/"
    },
    {
      "slug": "kaduse-medikal",
      "name": "Kaduse Medikal",
      "shortDescription": "Medical-equipment brand (starting with stethoscopes) for healthcare professionals and students in Turkiye.",
      "registryStatus": "ACTIVE",
      "language": "tr",
      "logo": "PASS",
      "colorPalette": "PASS",
      "typography": "UNSET",
      "monitoringSources": "UNSET",
      "channelPackPath": "channels/kaduse-medikal/"
    },
    {
      "slug": "yeni-nesil-romanci",
      "name": "Yeni Nesil Romancı",
      "shortDescription": "Literature, editorial writing, quotations, and writing culture.",
      "registryStatus": "PLANNED",
      "language": "UNSET",
      "logo": "UNSET",
      "colorPalette": "UNSET",
      "typography": "UNSET",
      "monitoringSources": "UNSET",
      "channelPackPath": null
    },
    {
      "slug": "turkiye-scholarships",
      "name": "Türkiye Scholarships",
      "shortDescription": "Premium platform helping international students find scholarships and universities in Turkiye.",
      "registryStatus": "ACTIVE",
      "language": "en",
      "logo": "PASS",
      "colorPalette": "PASS",
      "typography": "UNSET",
      "monitoringSources": "UNSET",
      "channelPackPath": "channels/turkiye-scholarships/"
    },
    {
      "slug": "futboscope",
      "name": "Futboscope",
      "shortDescription": "Quote-driven Turkish football commentary Reels, filtered for genuine analysis over transfer noise.",
      "registryStatus": "ACTIVE",
      "language": "tr",
      "logo": "IN_PROGRESS",
      "colorPalette": "PASS",
      "typography": "UNSET",
      "monitoringSources": "UNSET",
      "channelPackPath": "channels/futboscope/"
    },
    {
      "slug": "macaristan-rehberi",
      "name": "Macaristan Rehberi",
      "shortDescription": "Hungary: education, student life, company formation, investment, and Türkiye–Hungary news.",
      "registryStatus": "PLANNED",
      "language": "UNSET",
      "logo": "UNSET",
      "colorPalette": "UNSET",
      "typography": "UNSET",
      "monitoringSources": "UNSET",
      "channelPackPath": null
    },
    {
      "slug": "dua-mecmuasi",
      "name": "Dua Mecmuası",
      "shortDescription": "Prayers, spiritual texts, and Islamic thought. Tagline: 'Dua bize yeter'.",
      "registryStatus": "ACTIVE",
      "language": "tr",
      "logo": "IN_PROGRESS",
      "colorPalette": "PASS",
      "typography": "UNSET",
      "monitoringSources": "UNSET",
      "channelPackPath": "channels/dua-mecmuasi/"
    },
    {
      "slug": "folk-saying",
      "name": "Folk Saying",
      "shortDescription": "Proverbs, idioms, folk wisdom, and cross-cultural short-form text.",
      "registryStatus": "PLANNED",
      "language": "UNSET",
      "logo": "UNSET",
      "colorPalette": "UNSET",
      "typography": "UNSET",
      "monitoringSources": "UNSET",
      "channelPackPath": null
    },
    {
      "slug": "context-turkish",
      "name": "Turkish Context",
      "shortDescription": "Turkish vocabulary and language usage taught through real cultural context.",
      "registryStatus": "ACTIVE",
      "language": "en",
      "logo": "IN_PROGRESS",
      "colorPalette": "PASS",
      "typography": "UNSET",
      "monitoringSources": "UNSET",
      "channelPackPath": "channels/context-turkish/"
    },
    {
      "slug": "dunya-burslari",
      "name": "Dünya Bursları",
      "shortDescription": "Global scholarships, international education, and student opportunities.",
      "registryStatus": "PLANNED",
      "language": "UNSET",
      "logo": "UNSET",
      "colorPalette": "UNSET",
      "typography": "UNSET",
      "monitoringSources": "UNSET",
      "channelPackPath": null
    },
    {
      "slug": "scope-turkiye",
      "name": "Scope Türkiye",
      "shortDescription": "Türkiye-focused social, cultural, educational, and current-context content.",
      "registryStatus": "PLANNED",
      "language": "UNSET",
      "logo": "UNSET",
      "colorPalette": "UNSET",
      "typography": "UNSET",
      "monitoringSources": "UNSET",
      "channelPackPath": null
    },
    {
      "slug": "iyilesme-kanali",
      "name": "İyileşme Kanalı",
      "shortDescription": "Research-based wellbeing and functional health platform: balance, consciousness, biology, transformation.",
      "registryStatus": "ACTIVE",
      "language": "tr",
      "logo": "PASS",
      "colorPalette": "PASS",
      "typography": "UNSET",
      "monitoringSources": "UNSET",
      "channelPackPath": "channels/iyilesme-kanali/"
    }
  ]
}
